{
  "$schema": "https://raw.githubusercontent.com/wilanis/wilanis-js/main/packages/core/schemas/connection-kind.schema.json",
  "label": "HTTP API",
  "description": "An HTTP base URL with headers every request carries, and optionally a throttle that paces the requests made against it. A PostgREST or Supabase REST endpoint is one: baseUrl to /rest/v1, apikey reading {{secrets.*}}.",
  "endpoint": "baseUrl",
  "settings": {
    "fields": {
      "baseUrl": {
        "type": "string"
      },
      "headers": {
        "type": {
          "fields": {},
          "open": "string"
        },
        "required": false
      },
      "timeoutMs": {
        "type": "number",
        "required": false,
        "description": "the most one request against this connection may take, in milliseconds, from when the throttle lets it through; past it the request is aborted. A whole number from 1 to 2147483647, the longest a Node timer waits. Absent: 30000"
      },
      "maxBodyBytes": {
        "type": "number",
        "required": false,
        "description": "the most an answer from this connection may weigh; past it the request node fails as a fault. Absent: no limit"
      },
      "throttle": {
        "type": {
          "fields": {
            "concurrency": {
              "type": "number",
              "required": false,
              "description": "at most this many requests in flight against this connection at once; the rest wait for a slot. A whole number, 1 or more"
            },
            "perSecond": {
              "type": "number",
              "required": false,
              "description": "at most this many requests started against this connection in any one second; the rest wait for the window. Above 0"
            }
          }
        },
        "required": false,
        "description": "how requests against this connection are paced. Every node that names the connection shares the one gate, so a map that fans out one request per element is held to it. Absent: no limit"
      }
    }
  }
}
