{
  "$schema": "https://raw.githubusercontent.com/wilanis/wilanis-js/main/packages/core/schemas/connection-kind.schema.json",
  "label": "OIDC issuer",
  "description": "An OpenID Connect issuer (Okta, Auth0, Keycloak...) asked to verify a username and password with the password grant. The identity token it answers is verified against the issuer's published keys, and the identity read from it; our own token is what the caller then gets, never the issuer's.",
  "endpoint": "issuer",
  "settings": {
    "fields": {
      "issuer": {
        "type": "string",
        "description": "the issuer URL; <issuer>/.well-known/openid-configuration is read"
      },
      "clientId": {
        "type": "string"
      },
      "clientSecret": {
        "type": "string",
        "secret": true
      },
      "scope": {
        "type": "string",
        "required": false,
        "description": "default 'openid profile'"
      },
      "groupsClaim": {
        "type": "string",
        "required": false,
        "description": "the claim holding the groups; default groups"
      },
      "timeoutMs": {
        "type": "number",
        "required": false,
        "description": "the most one request to the issuer may take, in milliseconds; past it the request is aborted. At most 2147483647, the longest a Node timer waits. Absent: 10000"
      }
    }
  }
}
